{
  "version": "1.0",
  "provenance": {
    "generatedBy": "content-architect",
    "generatedAt": "2026-09-19",
    "repoRef": "f62b23e (master) on branch docs/windows-front-end",
    "mode": "audit",
    "tracks": "GitHub issue #22 (Refresh repository documentation after v0.1.0); also resolves the MSTest doc statement from #35 by describing the current state",
    "auditNotes": [
      "Commit f62b23e removed plans/, docs/evidence, apps/windows/tools, crates/super-duper-core/examples, ROADMAP.md, several docs and 32 scripts. README.md, AGENTS.md, crates/CLAUDE.md and seven docs still referenced removed material.",
      "No end-user documentation of the Windows app existed beyond README and CHANGELOG bullets; no maintainer architecture documentation of the WPF app existed beyond AGENTS.md layering rules.",
      "docs/architecture.svg predates the worker and shows the Windows app as a future FFI client. It is wrong and is removed; the replacement is a diagram request on arch-overview.",
      "dev-notes.md duplicates AGENTS.md (storage) and README (runtime files) and is folded into those and removed, per #22.",
      "House style: the repository wraps prose near 100 columns with several sentences per line and uses sentence-case headings in newer docs. Drafts follow the repository convention rather than docs-helper's one-sentence-per-line rule; every other docs-helper rule applies."
    ],
    "drafting": "Phase 6 drafted 2026-09-19 on branch docs/windows-front-end. Prose follows the repository conventions noted in auditNotes. No diagrams were rendered (Node.js unavailable)."
  },
  "scope": "both",
  "project": {
    "name": "Super Duper",
    "kind": "app",
    "summary": "Review-only duplicate file finder: a Rust engine and JSONL worker behind a WPF/.NET 10 Windows 11 app, plus a headless CLI and a C ABI."
  },
  "audiences": [
    {
      "id": "app-user",
      "name": "Windows app user",
      "description": "Someone who downloads the release zip and uses the app to find duplicates and record keep/remove decisions. Knows Windows and their own folders; does not read code.",
      "expertise": "beginner"
    },
    {
      "id": "maintainer",
      "name": "Maintainer",
      "description": "A developer or coding agent changing the Windows app, the worker or the engine. Reads C# and Rust; needs the layering, runtime behavior, conventions and decisions.",
      "expertise": "expert"
    },
    {
      "id": "release-operator",
      "name": "Release operator",
      "description": "The person who verifies and publishes a release on the dedicated Windows VM and runs the gates CI cannot.",
      "expertise": "expert"
    }
  ],
  "sources": [
    {
      "id": "app-composition",
      "path": "apps/windows/src/SuperDuper.Windows/App.xaml.cs",
      "type": "entrypoint",
      "note": "Composition root: .uidev sidecar (Debug), state locations, single-instance gate, DI registrations including DisabledRecycleOperationCapabilityExecutor, startup and exit."
    },
    {
      "id": "app-mainwindow",
      "path": "apps/windows/src/SuperDuper.Windows/MainWindow.xaml*",
      "type": "entrypoint",
      "note": "Shell layout: tabs and sub-tabs, banners, recovery card, unsaved-setup prompt, responsive breakpoints, preference persistence, focus targets, shutdown sequence."
    },
    {
      "id": "app-views",
      "path": "apps/windows/src/SuperDuper.Windows/Views/*.xaml*",
      "type": "api",
      "note": "Every user-visible label, access key, keyboard handler and layout breakpoint."
    },
    {
      "id": "app-wpf-support",
      "path": "apps/windows/src/SuperDuper.Windows/{Accessibility,Resources,Services,Converters}/**",
      "type": "api",
      "note": "AutomationNotificationBehavior, WindowTextScale, ShellResources tokens, WPF services (dialogs, clipboard, dispatcher), PlainPathConverter, ServerSortInteraction, DecisionActionFocus."
    },
    {
      "id": "shell-vm",
      "path": "apps/windows/src/SuperDuper.Windows.Core/ViewModels/ShellViewModel.cs",
      "type": "api",
      "note": "Navigation model (WorkspaceArea/Destination), pane loading, connection states, restart and recovery, completion navigation, close confirmation."
    },
    {
      "id": "core-viewmodels",
      "path": "apps/windows/src/SuperDuper.Windows.Core/ViewModels/*.cs",
      "type": "api",
      "note": "Behavior behind each screen: setup, progress, files, folders, preflight, preference rules, history, warnings, performance, recycle/recovery review."
    },
    {
      "id": "setup-validator",
      "path": "apps/windows/src/SuperDuper.Windows.Core/Validation/SessionDefinitionValidator.cs",
      "type": "config",
      "note": "Saved-scan validation rules, limits, default ignore patterns, drive-type warnings."
    },
    {
      "id": "worker-contracts",
      "path": "apps/windows/src/SuperDuper.Windows.Core/Workers/*.cs",
      "type": "api",
      "note": "IWorkerClient families, DTOs, progress contract, WorkerDatabaseUnavailableException reasons and user text."
    },
    {
      "id": "worker-client",
      "path": "apps/windows/src/SuperDuper.Windows.Infrastructure/{WorkerClient,ResponseCorrelator,Protocol/JsonLineProtocol,WorkerRunProgressParser,ReviewLiveHintBatcher,BoundedDiagnosticLog}.cs",
      "type": "api",
      "note": "Process launch, hello handshake, correlation, event dispatch, stderr capture and log rotation, restart, live-hint batching."
    },
    {
      "id": "worker-locations",
      "path": "apps/windows/src/SuperDuper.Windows.Infrastructure/{WorkerExecutableLocator,WorkerStateLocations,SingleInstanceGate}.cs",
      "type": "config",
      "note": "Worker discovery rules (Debug vs Release), state folder and env overrides, single instance per state folder."
    },
    {
      "id": "infra-services",
      "path": "apps/windows/src/SuperDuper.Windows.Infrastructure/{WindowsExplorerService,WindowsCloudLocationService,JsonPresentationPreferencesStore,WindowsRecycleBinService,WindowsTextScaleSource,DisabledRecycleOperationCapabilityExecutor,WindowsRecycleOperationExecutor}.cs",
      "type": "api",
      "note": "Explorer reveal and grouped selection, cloud sync-root detection, presentation preferences, Recycle Bin navigation, disabled vs real recycle executor."
    },
    {
      "id": "windows-manifests",
      "path": "apps/windows/{Directory.Build.props,SuperDuper.Windows.sln,src/**/*.csproj,src/SuperDuper.Windows/app.manifest,src/SuperDuper.Windows.Infrastructure/NativeMethods.txt}",
      "type": "manifest",
      "note": "Target frameworks, packages, version, worker copy targets, long-path manifest, CsWin32 APIs."
    },
    {
      "id": "toolchain-manifests",
      "path": "{Cargo.toml,rust-toolchain.toml,global.json,about.toml}",
      "type": "manifest",
      "note": "Workspace version, Rust floor, .NET SDK pin, license policy for notices."
    },
    {
      "id": "core-tests",
      "path": "apps/windows/tests/SuperDuper.Windows.Core.Tests/**",
      "type": "test",
      "note": "View-model and validation behavior against in-memory doubles; the most reliable statement of intended UI behavior."
    },
    {
      "id": "infra-tests",
      "path": "apps/windows/tests/SuperDuper.Windows.Infrastructure.Tests/**",
      "type": "test",
      "note": "Protocol, locator, state, preferences, Explorer, real-worker lifecycle, database_unavailable, recovery; opt-in RealCloudProvider/RealRecycleBin/RealRecycleBinProvider categories."
    },
    {
      "id": "smoke-tests",
      "path": "apps/windows/tests/SuperDuper.Windows.Smoke.Tests/**",
      "type": "test",
      "note": "In-process STA WPF surface tests with fixtures and optional capture variables."
    },
    {
      "id": "smoke-script",
      "path": "scripts/Invoke-WindowsSmoke.ps1",
      "type": "test",
      "note": "Worker protocol smoke plus real-desktop WPF UI Automation journey and close scenarios."
    },
    {
      "id": "uidev-script",
      "path": "scripts/Start-WindowsUiDev.ps1",
      "type": "entrypoint",
      "note": "Disposable-state Debug/Release launch, five-file fixture, .uidev control launch."
    },
    {
      "id": "release-scripts",
      "path": "scripts/{Verify-WindowsRelease.ps1,New-ThirdPartyNotices.ps1,Generate-WindowsIcon.py}",
      "type": "ci",
      "note": "Release matrix, publish, notices, package; icon generation."
    },
    {
      "id": "ci",
      "path": ".github/workflows/ci.yml",
      "type": "ci",
      "note": "build-and-test and release-package jobs on windows-latest."
    },
    {
      "id": "worker-dispatch",
      "path": "crates/super-duper-worker/src/{lib.rs,main.rs,progress_projection.rs}",
      "type": "api",
      "note": "Method dispatch, events, error codes, database lock and database_unavailable, shutdown, progress projection."
    },
    {
      "id": "core-storage",
      "path": "crates/super-duper-core/src/storage/{schema.sql,sqlite.rs,queries.rs}",
      "type": "schema",
      "note": "Schema v15, migrations, open-failure classification, session delete cascade and refusal."
    },
    {
      "id": "core-telemetry",
      "path": "crates/super-duper-core/src/telemetry/**",
      "type": "schema",
      "note": "Status database schema and limits, progress constants and wire names."
    },
    {
      "id": "core-engine",
      "path": "crates/super-duper-core/src/{engine.rs,scanner/**,hasher/**,analysis/**}",
      "type": "api",
      "note": "Scan pipeline: discovery, size grouping, partial and full hashing, repeat cache, exact folders."
    },
    {
      "id": "existing-docs",
      "path": "{README.md,AGENTS.md,CHANGELOG.md,dev-notes.md,crates/CLAUDE.md,docs/*.md}",
      "type": "history",
      "note": "Claims audited against code; findings recorded per document."
    },
    {
      "id": "history-cleanup",
      "path": "git:f62b23e; GitHub issues #22 and #35",
      "type": "history",